formatted_lemmed_text,emotion
ipad found friend jeff thanks everyone helped especially,Positive
packed many apple device alarm set 5 15am see ya'll psyched meet finally many guy,Positive
first ipad2 sighting interactive infact everyone least 1 apple product use time,Positive
want ipad2 win,Positive
download daily grape new app iphone take wine shop,Positive
forbidden apple spoiled long live samsung rocking amp sxswi's world,Negative
made decision id like purchase ipad would perfect,Positive
getting idea save ipad using action list true gtd syncs w iphone amp web,Positive
decided need ipad usguys,Positive
model one apple come cool tech one's ever heard cuz go conference,Positive
ipad design panel hilton salon j filling quickly surprise tapworthy fun ipad2,Positive
bit disappointed two ipad talk many overlapping example,Negative
every dj spin ipad part arsenal future coming wait,Positive
hope u jinx nice iphone app behaving today crash yesterday ridiculous,Positive
thank goodness ran ipad 2 worry giving buying one popup apple store,Positive
fest tip iphone douche put away phone talk fellow festgoers line etc good people love film,Negative
apple driving consumerization empowered,Positive
android party kinda embarrassed iphone,Negative
friend finally put android get app amp get disc kh,Positive
schedule heavier laptop where's ipad already,Positive
anybody get mobile apps work i've downloaded android iphone blackberry get stuck downloading startup,Negative
i'm already jealous apple popup store gonnagetanipad2,Positive
already tell brought as pillow iphone backup charger numbassonfloor,Positive
srsly love promo srsly hate excludes esp since ipad insists i'm disney,Negative
white ipad2 64gig wifi available austin apple popup store right wait,Positive
dgtltribe openbeta6 ipad give away fantastic going squeeze,Positive
sure total scene spoke austin apple store cautiously optimistic nerd,Positive
look like apps iphone blackberry blackberry,Positive
even use iphone evidence might well call country united state apple sxswsa,Positive
liking apple pop store sixth street congress avenue,Positive
fail whale artist living ipad 2,Positive
line longer 3 11 temp apple store ipad2 3 14 microsoft booth ie9 yeah right,Positive
short line apple pop store austin 50 60 people ipad2,Positive
whoa line pop apple store downtown austin ipad midnight madness,Positive
new iphone autocorrect already tried change coworkers visigoth going long five day,Negative
iphone battery made,Negative
one best photo apps iphone hipstamatic getting apps hipstamatic,Positive
smart move apple opening popup store ipad2 launch downtown austin,Positive
sweet convore iphone app ready,Positive
guy couch playing white ipad 2 mashbash party around making statement dammit,Positive
yes apple design win new isack soo cool,Positive
apple fanboy bought ipad 2 sweeeet special apple pop store,Positive
hey apple fan get peek space that's slated pop apple store tomorrow,Positive
going foot forget stop newest apple store austin,Positive
here's guy bought first ipad2 popup store hope register thoora beta,Positive
xwave headset actually control iphone apps brain sxswnui gsdm,Positive
apple hope notice ipad 2 sxswi technology mobile prodmktg,Negative
win free ipad 2 webdoc com awesome tech right,Positive
inside ipad 2 chip brings 50 browsing boost best hungry tip mekong river g,Positive
omg free ipad 2 salon h one,Positive
would love ipad2 get food forget snap photo win macbook air ipad 2,Positive
hope may someday keynote swsx bored keynote ipad,Positive
leaning web convention like small button ipad uxdes,Negative
one face ex stealing show yr apple school mkt expert,Positive
loving new iphone app suggestion coming,Positive
omg table next u passing around ipad 2 hipstermuch,Positive
tim get one apple employee showed force popup apple store ipad2,Positive
wow apple pop store downtown austin projecting 1 4 million profit weekend alone may stay past weekend,Positive
omg apple pop retail please let full palette ipad2's truck parked back,Positive
wow apple really thought,Positive
lol 2 true official people using ipad 2 take photo look weird,Negative
yes please want win ipad get case,Positive
anyone see visit temporary apple store,Positive
ah nice simple idea hello holler gram get know new ipad app hollergram,Positive
temp apple store killing austin selling early every day,Positive
apple store popped huge crowd waiting geek dream come true,Positive
live stream working ipad fail,Negative
apple survival kit taking apple stuff clothes,Positive
hmm com interactive live stream ipad mobile compatible maybe next year,Negative
yay love ipad 2 perfectly portable travel we've thanks pop store,Positive
look like fun session mistake made building nextflix iphone,Positive
may hide tweet think apple pop store final straw yes i'm jealous,Positive
would like know lb app downloaded commandeered iphone's geolocation setting amp relinquish batterykiller,Negative
google tv ipad app connected tv experience talk super rad sxsw11,Positive
great see u i'll austin convention center today w fam showing new iphone game,Positive
iphone user kill yo self u hated ubertwitter new ubersocial iphone app store includes uberguide,Positive
love wave ipad webber japan,Positive
traded xoom j party ipad 2 winwin winning tigerblood,Positive
dear apple could roll hot dog cart full ipad 2's austin convention center bring hot dog,Positive
new iphone new ipad 2 come running fast cuz every girl crazy sharp mac man strum guitar,Positive
cover time apple store w 9 others,Positive
hey people launch follow detail chance free ipad 2,Positive
want one rumor apple opening temporary store downtown austin ipad 2 launch,Positive
oh apple ridiculous even begin apple win via,Positive
genius idea apple popup store,Positive
update heading apple store buy ipad,Positive
getting ready ipad design headache,Negative
getting ready installing iphone woot,Positive
already paying dividend discovered couple cool apps iphone android,Positive
never realized shitty iphone battery i'm charging every hour,Negative
apple steal show pop marketing gt,Positive
met team set apple store set whole place nothing 3 day great work,Positive
nice hear mint com working ipad app ftw sxswi,Positive
appears apple opening pop store austin employee trying hide beechwood table gave away,Positive
several year late think trend social apps google circle conversation,Negative
another reason go austin apple open popup store,Positive
great blog latest news like opening apple store sxsw2011,Positive
that's great i'm unique i'm one w iphone 3gs others follower iphone 4 winning,Positive
today's tech tidbit ipad 2 take video via ipad2 tech,Positive
echofon iphone amp mac mute function block amp sxswi wait,Positive
heck would anyone want mozilla switch crapkit webkit gecko good stupid apple google bandwaggoners,Negative
apple cited opposite crowdsourcing proprietary steve job tell want csuitecsourcing,Negative
amused apple pop store year brilliant idea brilliant,Positive
walked line ipad 2 bahahahaha least 5 block long fail,Negative
called hot spot mobile heatmap iphone app leveraging 4sq help find hot quiet place,Positive
updated iphone app song info select stream incl 24 7 amp live video streaming time,Positive
connected bluetooth keyboard iphone hello fast blogging i'm,Positive
convinced upgrade ipad 2 held one trade show failed willpower check,Positive
showed charge anywhere bar charge iphone whole table wanted buy one,Positive
walked past supposed apple temp store downstairs apple cult outside taking photo iphones,Negative
passed apple store 6th easily 150 folk line,Positive
picked book killer photoes iphone sxswchi,Positive
picked ipad 2 back,Positive
free coffee company free drink company b free food company c money saved go apple life,Positive
guess need figure session ipad app killer selection overwhelming,Positive
already seeing heavy ipad 2 presence duh,Positive
week total ipad envy fb,Positive
good meet see forget mindjet giving away ipad best mindmanager map sxswi detail,Positive
prefer news iphone ipad droid apps amp mobile apps,Positive
like vega ce iphone best used hand warmer,Negative
great panel ipad magazine design pulling article different mag sound awesome who's going build touchingstories,Positive
panel staying alive indie iphone game development survive kind downer try coronasdk,Negative
airport delay introduced catphysics feel like drug pusher first ipad play free,Positive
apple's release ipad 2 huge win especially international attendee town show,Positive
note self downside tweeting white ipad 2 expect mocked,Negative
believe god explanation apple's continued existence guy kawasaki enchantment,Positive
tell happening 15 iphone apps update day,Positive
i'm insanely jealous everyone ipad seems like great way interact panel next year p,Positive
apple's temporary megastore could model future conference event,Positive
attendee need one best qr scanner creator iphone send u pic qr code found free copy optiscan,Positive
friend think abandoned reality mean communication iphone stopped working fail,Negative
normal scene ipad lap iphone hand,Positive
happened taxi magic iphone app call cab via,Negative
apple opening pop shop austin man everywhere,Positive
funny moment panel dennis crowley get ipad 2 owner hold new ipad 2 looked like lighter rock concert,Positive
essential water energy bar smart phone camera map dt sunglass rainjacket laptop ipad mp3 player ipod earplug,Positive
g love apple pop store one question amp bring truck signal please say yes,Positive
ha apple come cool technology one's ever heard go conference,Positive
geek need somewhere downtown line get ipad 2 i'll dropping,Positive
lol apple come cool technology one's ever heard go conference,Positive
lol apple come cool technology one's ever heard go conference via,Positive
lol apple come cool technology one's ever heard go conference ausxsw,Positive
chatting via iphone hilarious,Positive
thanks giving new top cover banged juicepack iphone case product rock tradeshow,Positive
intrvw govt vending machine put get svcs platform iphone teaching moment,Positive
woot rumor apple opening temporary store downtown austin ipad 2 launch,Positive
yes lol u r gadgetzilla fun festival time omg i'm scared got netbook ipad amp droid,Positive
wew new ubersocial iphone app store includes uberguide sponsored cont,Positive
badger angel news nice one also we're giving away free ipad 2 contest,Positive
video playbook action ipad still win,Positive
pop store austin brilliant long line even 9 30 night,Positive
ipad envy roof thanks every person,Positive
maybe someone get ipad2 hand old ipad instead throwing away,Positive
oh utter fail can't see letter ballroom iphone app long wrap cc,Negative
life hacker debut steampunk ipad 37 ft reclaimed copper piping one mini maglight kinda thin etch sketch interface,Positive
mega tether iphone android party chargin2diffphonesatonce dorkinout,Positive
never apparent nice would apple made stuff w removable battery alwayshavingtoplugin gsdm,Negative
enter contest maybe win ipad 2,Positive
day closer becoming owner ipad 2 stoked thing getting final,Positive
sitting flipboard panel wishing ipad ala two year old completely overtaken flipboard,Positive
ahh wonderful news ipad 2 available online ordering go get ur,Positive
we're experimenting tinkering like ninety best viewed ipad new best viewed internet explorer 6,Positive
suffering ipad envy,Positive
iphone user gps stuck one new geo app update foursquare gowalla,Negative
apple offer original ipad donation program entry friend house,Positive
farmer use blackberry iphone ipad catching bigger screen mobilefarm,Positive
texas observer tomlinson say would double revenue per issue ipad subscription newsapps,Positive
great interview bloomberg tv ipad2 kick apple,Positive
cool potential non text application iphone awesome,Positive
pair nice back back talk morning interface design ipad future touch general,Positive
hope everyone awesome weekend know giving away great apple prize,Positive
apple take bruise panelist well regarded sustainability space corporate sustainability reporting transparency,Negative
apple like pay that's apple like barry diller,Negative
daily ipad going evolve they're still impossible download 20 mb downloads,Negative
ipad 2 go sale 3 pm i'm looking 32 gig color preference,Positive
free itunes featured artist sampler free music,Positive
apple save set open pop store cnet news,Positive
apple save set open pop store apple,Positive
holy smoke ipad2 replacing flip cam default video capture device beautiful elegant apple,Positive
omgz makeshift apple store gold gym,Positive
sooo design ipads session hour long ad buy ipad apps amismarternow,Negative
ipad design headache take two tablet call panel excited hear live,Negative
that's awesome rumor apple opening temporary store downtown austin,Positive
wow shakespeare's pub 6th st here's delete button iphone video camera,Positive
madness already downtown 1st day apple popup store seems brisk biz,Positive
ipad success apple popup store austin apple,Positive
sxxpress line almost long apple line,Negative
awesome restaurant week app iphone austinites,Positive
fun meet folk couch couchfan app made ipad lovesit,Positive
anybody get ipad 2 downtown apple pop store yet trampling letushopenot poppop,Positive
killer meet ups new old friend today apple microsoft solo killer many letschangetheworld,Positive
complete io dominance compels apple open frickin temporary apple store downtown austin week,Positive
ipad 2 queue epic,Positive
even cabby tech savvy that's iphone streaming twitter,Positive
freaking everyone ipad iphone 4 mac wow,Positive
ipad 2 review seem range wait 2012 3 4 5 shat fan boy knickers,Positive
amazing new app mobil worker iphone app telework,Positive
love new ipad 2 seems much faster fluid original seems natural hold excited use week,Positive
love new iphone case featuring glad got case zazzlesxsw,Positive
awesome new version iphone new web site coming want demo meet pls,Positive
exposing iphone's horrendous battery life,Negative
novelty ipad news apps fade fast among digital delegate aron pilhofer nyt amp khoi vinh medium,Negative
outside 9 30 panel 75 people skip barely get anything work iphone need shrink 10k people,Negative
novelty ipad news apps fade fast among delegate,Negative
pollak much trouble sell apple duh sxswbigbrands,Negative
feature iphone week,Positive
kick sxswi giving away ipad 2 visit fb page enter,Positive
showing ipad 2 pretty much like showing puppy anywhere else get fawning attention dont ha,Positive
turning twitter ipad forgotten,Negative
showing uzu ipad app tapworthy,Positive
kicking w talking ipad design headache,Negative
wifi working laptop neither 3g iphone grrr,Negative
awesome first day apple approved new app go download check blog big stereo ipad2,Positive
ipad flight wifi sitting behind ready shiner,Positive
prepping attending without iphone dehumanizing experience,Positive
ipad2 3 week w ipad since gave withdrawal,Positive
line apple popup store stretch around block guess getting ipad2 today,Positive
line ipad2 pop apple store outlandish entire week,Positive
life can't get ipad sync session partial iphone fine ipad deciding want,Negative
friend austin i'll buffalo new ipad,Positive
cab ride hell get apple store mall sold getting dinner figure get back hotel,Negative
woman front etch sketch housing ipad awesome,Positive
i'm frontend dev talk way turned head far could see single non apple device cor,Positive
navigating crowded party suck way worse everyone walk around face iphone adpeopleproblems,Negative
nice able use usb charging cord plug add juice iphone dfw,Positive
mullenweg admits iphone app wordpress good yet true respect honesty awareness,Negative
big buzz year ipad 2 course group chat text service like group yobongo know fb,Positive
best thing i've heard weekend gave ipad 2 money japan relief need ipad 2,Negative
regretting bring ipad seeing lot time would useful especially battery life woops,Positive
i'm loving apple pop downtown office long last u local,Positive
lining get ipad 2 apple pop store much long line,Positive
gadget addicted apple fanboy manage come home without ipad 2 suspense intense intense suspense,Positive
stay charged visit mophie booth 1406 08 great deal juice pack ur iphone stay tuned flash giveaway,Positive
changed mind need ipad infektd need wider screen detect zombie,Positive
apple genius pun intended check,Positive
genius may actually buy ipad 2 tomorrow apple temporary store downtown austin,Positive
well forget nfl lockout right gonna focus getting shinmy new ipad 40min apple make happy nfl,Positive
getting new ipad flash apple store,Positive
food4thought juxtaposed ipad rocking lybian rebel thwarted gorgeous day la amp japan reeling,Positive
tech lightbox photo want new android camera app although android adoption technology,Positive
quit fighting ipad2 apple store w 59 others,Positive
tm litle girl want ipad guess got get one checked apple pop store,Positive
got given free portable iphone charger sweet thx powermat,Positive
glad i've got faulty iphone go well everyone's battery dy 5 time quicker hope know,Negative
ipad design know value white space tapworthy gsdm,Positive
ipad design headache interface metaphor look like book make behave like book simple stuff often forgotten,Negative
ipad design malady ipad elbow hate ipad's back button heat million sun tapworthy,Negative
ipad design panel good,Positive
ipad design session packed hilton salon j w 21 others,Positive
ipad design talk great ran late haul as get ballroom innovative design biomimicry,Positive
go i'm still using iphone 3g oldschool novideo veryslow,Negative
who's gonna getting ipad2 apple store today bet que getting bigger ipad2 bet,Positive
good job went home amp watched season 1 guild suck tweet abt iphone hijack top tweet lol,Negative
whoohoo got new ubersocial iphone app store includes uberguide cont,Positive
sweet got ipad that's nerd joke,Positive
great news u twit crew apple building temporary store 2011 u get ur ipad 2,Positive
totally agree check googletv ipad apps connected tv connectedtv fascinating,Positive
security guard enjoying ipad2 apple store austin ipad2,Positive
lt guess ipad unsix tweetup thanks amp happydance,Positive
busdev guy come ipad2 line ask wr feel ipad2 good discussion iads apple crazyco,Positive
homeless guy outside pop apple store holding sign saving ipad 2 ask photo,Positive
technology apple opening pop store austin geekfest apple brian lam thousand tech,Positive
technology apple school marketing expert thousand town demonstrate social tech,Positive
technology even begin apple win past week there's major dilemma tech,Positive
party dj jo playing red bull bpm ipad courtyard,Positive
last month discovr ipad midem time discovr iphone climbing app store chart,Positive
math flight leaf 6 45 clock go ahead 2 iphone alarm go time miss flight,Negative
awwww yeah congrats winning last ipad case boyfriend aw cbatsxsw,Positive
ha feel like person non mac ipad,Negative
ipad2 hand thanks popup apple store first impression may lemon backlight bleed thru bottom,Negative
enchanting offer likeability virgin air trustworthiness zappos amp great product apple,Positive
enchanting offer likeability virgin airline trustworthiness zappos amp great product apple,Positive
hard time tweeting using iphone using ipad much better hisxsw,Positive
interesting presentation ipad helped disability insightful poursite,Positive
google analytics 58 967 visit ipad iphone ranked top 5 way people access newsapps,Positive
trend tomlinson seeing age ipad owner higher expected say 55 demo newsapp,Positive
must app ipad going hollergram,Positive
y'all seen temp apple store going downtown would y'all stream instead,Positive
wow apple popup store downtown austin real let's,Positive
free itunes store 22 track featured artist grab gone thanks apple,Positive
checked apple store line way man line long toolongforme,Positive
amazing amount app update ipad today kick,Positive
back big apple need wean new foursquare addiction thanks people really care nah,Positive
nick time get iphone eventseekr app,Positive
nice im heading barton creek get mackbook pro waiting outside apple store ipad2 woohoo,Positive
heard apple's going open special store they're expecting lot customer,Positive
kara swisher apple stylish fascist company america,Negative
hey eric pop apple store nice long line tech savvy folk ready spend hard earned,Positive
hey mark sleep bring home shiny new ipad would ya,Positive
fashion essential 2 ipad plus 2 mobile phone chronicling witty tweet unlocking mayor badge taking photo hootsuite owl,Positive
threw together keep ipad attempt keep hour stuff weekend,Positive
apple's white earbuds good symbol need social proof ipod launched knew new toy guykawasaki,Positive
well cashmore gave new ipad crushing non endorsement checkins ouch,Negative
iphone android apps keep grooving,Positive
rip iphone 4 june 2010 survived severe drop could evade drowning,Negative
self respecting apple fanboy attend interactive event year without ipad2 sxswi,Positive
new whrrl app live iphone app store android marketplace get hot time,Positive
new whrrl app live iphone app store android marketplace get hot time via,Positive
bought mophie juice pack iphone solely cool kid,Positive
bought ipad2 downtown austin apple store 5 min wait line get salesperson darryl excellent,Positive
bought ipad impulse must something water,Positive
bought ipad 2 15 minute apple store w 23 others,Positive
great night interactive party congress ave amazing apple store apple,Positive
bought one last ipads apple store downtown austin sold done purchasing,Positive
bought last ipad 2 3g 64mb apple pop store,Positive
passed huge queue ipad design boomer way mobile apps learn comic book also full,Positive
agree apple stole little part show exciting new biz concept,Positive
fully expect ipad shamed 2's,Positive
tomorrow go back apple store sigh,Negative
got impression plan stand line ipad 2 march 25th though,Positive
hate typing ipad yeah ken calhoun man real deal bringing laptop sun,Negative
feeling many shiny new ipad 2,Positive
heard got first ipad 2 10 5hrs austin,Positive
hope year's festival crashy year's iphone app,Negative
know premature tweet i'd love see pic apple pop store,Positive
meant itunes work ie run apple software even would run ubuntu desktop dl,Negative
outdid time tech fail iphone broken might worst thing ever happen,Negative
crowley really want new ipad time get checkins ketchsx,Positive
think might quit resume tonight ipad iphone tethering happened better time,Positive
used think started making great apps official app ipad blow version site away,Positive
want ipad case sxswbuffalo,Positive
5 30 line around block decided forgo ipad 2 goodness food apple,Positive
wish liveblog iphone app amp wordpress plugin ready quite,Positive
i'm glad ipad 2 think,Negative
dang i've touched ipad 2 want sigh,Positive
josh williams said farmville success wakeup call game build iphone thing going,Positive
totalitarian thought action people worldwide come austin tx decide spend time line apple store,Negative
rediculous overflow line ipad session sxswsmall interesting talk like what's said miss ipad talk,Positive
ridiculous see someone taking photo session ipad cannot wait see concert use silly,Negative
wooooo mention released discovr iphone time new feature,Positive
like said peep taking picture ipad 2 looking ridculous still want one,Positive
lie i've chance watch people actually using ipad make want one,Positive
movie star moody director well fine guy who's really attracting crowd one showing ipad 2,Positive
wonder apple intentionally scheduled ipad2 release coincide steve job crafty genius,Positive
i'd stay away apple store tomorrow,Negative
wonder there's anyone who's snagged ipad 2 supposedly there's apple store somewhere campus,Positive
related u verizon u better bandwidth issue blackberry always tweeted iphone dawdled wjchat,Negative
pull name contest win ipad ipad2 cash suckling pig dandy shirt hold 4,Positive
biggest line buy ipad 2 every compan open bar,Positive
pinoy insight conf conf mobile ipad app great use even plan day friend,Positive
ipad design ui tip button hack approach skepticism tapworthy,Negative
iphone amigo app change broadcastr bestappever,Positive
farmer like blackberry smart phone iphone's last long farm mobilefarm,Negative
tablet like ipad xoom touch emulates mouse click keyboard input mean we're yet gswsxsw futureoftouch,Negative
techie fail one panel moderator europe say spent 3000 roaming charge iphone 2010,Negative
content move back browser replicate work ipad u press one button,Negative
time atx apple open pop store debut cool amex partnership even start till fri,Positive
time launch unofficial insider's guide iphone nice bynd,Positive
100 line apple pop store everyone waiting ipads first guy arrived 6 30am 36 degree badge everywhere,Positive
standing line 6th time ipad2 apple popupstore,Positive
wait line apple store ipad 2,Positive
mad mad line still apple pop store austin ipad2,Negative
geek influence hit new high yesterday apple opened pop store sale ipad 2,Positive
foodspotting iphone app success finding food crave,Positive
we're giving away shiny ipad 2 quotables simply sign entered automatically gt gt ipad2,Positive
good morning everybody ipad 2 take video via mashable apple,Positive
volunteering lot boring expected thumb already getting tired extreme iphone usage,Positive
bored keynote ipad,Positive
i'm debuting new iphone amp droid app next year make phone waterproof amp light cigarette,Positive
i'm thinking may actually take laptop ipad alone may enough trip,Negative
amazing apple pop austin store executed quickly 1 week via,Positive
i'm sporting new 3 io iphone get amp install time ever 4sq,Positive
