formatted_lemmed_text,emotion
really finding enjoying ipad design principle well done tapworthy useful clear point throughout,Positive
apple opening pop store austin exactly wanted,Positive
putting gun head give iphone,Positive
apple classiest fascist company america say,Negative
best thing i've heard weekend gave ipad 2 money japan relief need ipad,Positive
forward delicious mobile 4g austin iphone user struggle anything,Negative
heard apple's pop store downtown austin pic already gowalla pop pop,Positive
next life i'm coming back ipad 2 woman can't keep hand thing,Positive
rumor apple opening temporary store downtown austin ipad2 launch,Positive
rumor apple opening temporary store downtown austin ipad 2 launch,Positive
talked mike tyson new iphone game let fight pauly celebs,Positive
love apple come cool technology one's ever heard go conference,Positive
love apple come cool technology one's ever heard go conference,Positive
new ubersocial iphone app store includes uberguide sponsored mashable,Positive
shiny new apps new book pop ipad 2 store christmas nerd,Positive
sound voice shot exploiting apple amp best buy's 14 day return policy imacs brilliant,Negative
texas observer tomlinson say would double revenue per issue ipad subscription newsapps,Positive
day bank america launched iphone app got 250k new customer bankinnovation,Positive
ipad 2 take video,Positive
giving away ipad 2 kick time visit fb page info,Positive
lose hour tonight attendee blame microsoft apple get credit fixing christmas,Positive
we're officially come grill mention u w zazzlsxsw get make iphone case,Positive
yes updated iphone app song info 24 7 stream others also live video streaming,Positive
haha awesomely rad ipad app hollergram via,Positive
rumor apple opening temporary store downtown austin ipad 2 launch,Positive
love apple come cool technology one's ever heard go conference,Positive
rumor apple store opening 6th amp congress sign point yes,Positive
saving ipad2 photo apple store,Positive
see member team carrying one bag show wolfram app amp get w iphone case,Positive
see new texas observer ipad app sxswi 3 30 sheraton,Positive
setting pop shop smartest move ipad imho developer matter ipad 2,Positive
shut rumor apple opening temp store downtown austin amp ipad 2 launch,Positive
slide talk ipad design headache tapworthy really interesting designer well,Negative
smart company rumor apple opening temporary store downtown austin amp ipad 2 launch bit ly g03mzb,Positive
smart apple open pop store austin people get new ipads bit ly i41h53 via,Positive
smartphone breakdown unofficial 98 5 iphones 1 android 03 blackberry 02 symbian window,Positive
kickass iphone developer want something cool follow shoot note,Positive
someone need host race sm apps iphone pink slip probably something much cooler th,Positive
speaks truth watched apple staff temp store high five entire long line facepalmed ugh longlinesbadux,Negative
spin play new concept music discovery ipad amp spin com itunes,Positive
spotted man need ipad 2 sxswi,Positive
still thinking awesome smileyparty going give ipad please,Positive
stop let u make custom iphone case zazzlesxsw sxswi,Positive
strange little japan news penetrates bubble bar tv cnn suggest anything important ipad 2 going fb,Positive
sweet apple's opening pop shop scarbrough building congress ipad 2 via,Positive
2011 novelty ipad news apps fade fast among digital delegate,Negative
get apple store atx,Positive
temp apple store 6th st austin closed night they're stuff say austin cop barring door,Negative
temp apple store killing austin selling early every day,Positive
temporary apple store apple sneaky usual,Negative
thank picked book killer photoes iphone sxswchi sxswi,Positive
iphone app unreal clicked location leanstartup amp person tell still seat,Positive
ipad 2 take video sxswi,Positive
ipad 2 take video via mashable apple,Positive
beluga iphone app highlight excellent way coordinate sxsw4japan relief effort,Positive
day bank america launched iphone app got 250k new customer bankinnovation,Positive
ipad 2 go sale next friday austin apple store going busy,Positive
ipad 2 thin could use cut line cocaine facetime mel gibson winning ipad2,Positive
ipad 2 also cartoonishly large digital camera cstejas,Negative
ipad 2 take video one biggest event first day 2011,Positive
ipad 2 take video,Positive
ironic tee usurped ipad 2 hipster geek start chic fashion item year's,Positive
valuable device far apple ipod iphone charger,Positive
new whrrl app live iphone app store android marketplace get hot time,Positive
hand judging pop store constant line apple ipad2 clearly breaking,Positive
everyone plane austin look like going mean apple product hipster clothes,Positive
session designingforkids changing mind future kid's relationship iphone sapient,Positive
top 7 thing i've loved far outbrain ipad groupme,Positive
upside start today ipad 2 release,Positive
web designer guide io android apps today 10,Positive
iphone apps keep grooving 2011,Positive
everywhere crazy look around realize last year one ipad,Positive
article good i'm linking iphone train,Positive
group next 6 ppl table everyone using thier phone ipad instead taking,Negative
awesome got ipad 2 via,Positive
one three best apps we've seen,Positive
thrilled former chief talent officer apple gap advisory board sxswi innotribe,Positive
tim soo's invisible instrument jaw dropping iphone wii controller openexhibits,Positive
time wakeuplaughing iphone appstore itun e ifr3dw,Positive
kick sxswi giving away ipad 2 visit fb page enter,Positive
tron amazing idea blue ray release 2nd screen ipad app syncs movie follow additional content,Positive
true rumor apple opening temporary store downtown austin 4 amp ipad 2 launch,Positive
turn ipad physical messaging platform holler gram cheeky app built,Positive
umm would keep winning shit thanks killer ipad case,Positive
updated npr music iphone app song info song 24 7 amp live video streaming time,Positive
happy discovr named one top ten must apps ipad 2 fight way thru queue,Positive
smart hollergram ipad app may leave vuvuzela home,Positive
smart move apple pop store ipad 2's come 5pm tomorrow,Positive
smart aapl open pop store ipad 2 sale,Positive
via still big line outside apple's pop shop 3 day ipad's debut,Positive
video first ipad2 unboxing outside apple store coming soon find decent wifi,Positive
w00t wrote hollergram ipad app,Positive
want win free ipad 2 attending detail,Positive
including emotional thing ipad barrydiller pnid,Positive
excited see hl dynamic video ad insertion tv everywhere working ipad2 later today popup apple store,Positive
can't wait give ipad someone want head www pep job upc enter must present win,Positive
launched ipad app get detail first edition free,Positive
launched spin's ipad app ton music photo video whatcha think,Positive
lose hour tonight attendee blame microsoft apple get credit fixing christmas,Positive
lose hour 2nite attendee blame microsoft apple get credit 4 fixing b4 christmas,Positive
we're wondering many come back ipad 2's maybe everyone,Positive
we've got exciting thing we'll showing year including drag drop store management iphone,Positive
web developer tried new relic sign enter win ipad 2 come booth 13,Positive
well forget nfl lockout right gonna focus getting shinmy new ipad 40min apple make happy nfl,Positive
well i'm first line 10 5 hour go ipad apple sleepy,Positive
bored keynote use ipad draw picture even good artist sxswi,Positive
smartphone rule definitely iphone 4 96 apple smartphone i've eyeballed ip4,Positive
whoa hang saw someone without iphone,Positive
win ipad 2 come meet aquent talent agent drop name booth 1413,Positive
win awesome ipad quibids custom case catch wearing openbeta vip badge,Positive
within hour buying ipad glenda watson hyatt cerebral palsy able communicate stranger public poursite,Positive
woke sandwiched iphone ipad forgot much like geek spring break,Positive
woman lobby there's website called like stupid iphone speller ppl taking pic funny autocorrected word,Negative
2nd place fandango karaoke 1st prize 1 yr fandango tkts useless canada 2nd prize useful ipad,Positive
woo hoo finally back iphone il,Positive
wooooo mention released discovr iphone time new feature,Positive
word motherboard want iphone apps heading today 10 hot one,Positive
wow developed ipad app 15k newsapps,Positive
wow thing insanely thin amp light hold ipad 2 seriously mosaicxm,Positive
wow shakespeare's pub 6th st here's delete button iphone video camera,Positive
yes hate fanboys still valid tho waited ipad2 instead enjoying,Negative
yes rumor true come play ipad booth exhibit hall 3 ipad ipad2 giant,Positive
yes updated iphone app song info 24 7 stream others also live video streaming,Positive
yes updated iphone app song info 24 7 stream others also live video streaming,Positive
yes updated iphone app song info 24 7 stream others also live video streaming,Positive
yesterday fantastic amp apple ipad 2 launch let's take moment 2honor suffered japan,Positive
zazzle officially come grille mention zazzlsxsw get make iphone case,Positive
zazzle officially come grille mention u zazzlsxsw get make iphone case,Positive
iphone app control mania half screen used button filter half content ui fail,Negative
iphone apps keep grooving 2011,Positive
iphone apps keep grooving 2011 via,Positive
someone buy ipad v1 wait line get v2 tomorrow,Positive
fuck iphone crapped charge say charging 5 night option austin,Negative
iphone developer meet crazy packed,Positive
one must apps survive join sxswbarcrawl sxswi,Positive
tip conference goer everywhere bring ipad leave laptop hotel i've battery sore shoulder week,Positive
amusing long line temp apple store starbu cks acrosse street people seem unpack,Positive
6th congress dude creatively saving ipad 2 www socialmediabum tumblr com,Positive
awesome conversation networking line apple store,Positive
social proof powerful marketing motivator see white earbud headphone cable know apple,Positive
jqtouch look amazing apple theme make web page look like native iphone apps geekery,Positive
look stupid take pix ipad 2 believe guy,Negative
cool apps coming making miss iphone 4 big way,Positive
kind cool someone trying screen mirroring ipad via camera hdmi cable gent,Positive
cool coolest ipad case ever etch sketch via,Positive
apple's pop store day ipad2 release could genius move marketing history,Positive
apple's pop store like girl scout planting next bank atm ca h money thinmints,Positive
apple's pop store plan austin,Positive
apple open pop store wannabe hipster feel home near fav store,Positive
apple open ipad2 popup shop core action brilliant bring hot shiny new toy peep,Positive
apple open popup store ipad launch genius bastard,Positive
apple opening temporary store austin people obviously want shell 1500 macbook visiting austin,Negative
apple opening temporary store austin people obviously want shell 1500 macbook,Negative
apple opening temporary store downtown austin march 11 accommodate attendee god fucking smart,Positive
apple opening temp retail store austin sell ipads attendee tempted,Positive
apple opening temporary store close sell ipad2 get influencers concept,Positive
apple opening temporary store conference ipad 2 launch might make stop,Positive
people back home seems putting together pop apple store people get ipad2 today,Positive
apple popupstore get ipad 0310apple,Positive
packing macbook ipad ahhh can't decide,Positive
waiting bestie come popup store ipad 2's apple ipad2,Positive
nyt app ipad here's amazing way serve readership here's market opportunity can't ignore newsapps,Negative
line ipad2 apple hype team made high five run,Positive
die antwoord awesome umshini wam korine park's night fishing amazing especially shot iphone 4,Positive
even begin apple win apple setup temporary store austin ipad 2 launch march 11th,Positive
tech even begin apple win technology,Positive
tech even begin apple win past week there's major dilemma technology,Positive
tech even begin apple win,Positive
hooray long line apple opening temporary store downtown austin amp ipad 2 launch,Positive
looking forward delicious mobile 4g austin iphone user struggle anything,Negative
looking forward hearing lynn teo tell nice thing probably already know ipad navigation uxdes,Positive
looking forward learning ipad design,Positive
looking forward seeing ipad 2 site alphagraphics bought 1 laser print 1986 scarborough building,Positive
looking forward iphone android design session can't wait drink give away stuff get paid,Positive
looking forward visiting apple store come congress ave apple sell ipad,Positive
finally got new iphone 4 tweet phone time gah torture addictedtotheinterwebs,Positive
reason apple's continued survival existence god enchantment sxswi,Negative
hootsuite chilltab tablet stand rock canadian social medium ipad best,Positive
folk taking note ipad sure download dan bricklin's app notetaker really sweet thanks,Positive
helping clean organize news content great job ipad owner sxswi,Positive
guy like presentation wanna try filmaster iphone,Positive
twitter failed last time force choke iphone,Negative
ouch look like might able grab one temp apple store,Positive
glad brought mac pc clearly cool environment may walk around theplatform ipad,Positive
life would much better ipad brainwashed line,Positive
android amp iphone app launch also keep handy lil device updated w event info eventseekr,Positive
word motherboard want iphone apps heading today 10 hot one,Positive
phone staying charged crappy iphone would never handle sleep crazyfest,Negative
social calendar app rolled special functionality iphone android,Positive
four south african capped 35 hour plane trip nine hour wait ipad line,Positive
part journalsim support democracy yes informed populous yes ipad focus support newsapps,Negative
jealous see people ipad 2 take photo iwantacameraonmyipad,Positive
checking ipad 2 pop store apple store w 17 others,Positive
checking ipad design headache 2 tablet call morning tapworthy fb,Negative
pen ink miamibeach iphone next week,Positive
checking apple pop store looking fwd checking ipad 2 mosaicxm mk,Positive
checking new fast society app iphone kinda like group foursquare nice thanks sharing,Positive
check great amp v effective enviro app bin iphone 3gs sxswi greatergood,Positive
line outside pop apple store crazy long festival get entertaining every day,Positive
bank innovate die great session 250k customer joined bank america 1st release iphone app,Positive
totally love copia cocoon messenger ipad bag picked attending redbox gilt group graphic ly sesh morning,Positive
dawned ipad 2 launch timed coincide gain maximum tech hipster attention genius apple,Positive
anyone know hour apple store kinda hoping open 24 hour,Positive
anyone know line like popup apple store ipad2,Positive
know geek 16162 cross road take picture apple pop store,Positive
setting pop shop smartest move ipad imho developer matter ipad 2,Positive
atzip iphone app released time waiting line bar 96 band app,Positive
setting ipad2 swift upbeat service morning apple pop store,Positive
loading iphone w apps prep i'm curious see rise top,Positive
first stop amp hunt austin java get spy game chance win ipad,Positive
amp iphone user friend keep borrowing verizon iphone chk schedule network ridiculously slow,Positive
got ipad 2 apple's pop store downtown austin,Positive
coolest ipad case ever etch sketch,Positive
coolest ipad case ever etch sketch via,Positive
put ipad idiot smcomedyfyeah,Negative
getting ipad envy flight,Positive
serious ipad envy toting around one's macbook pro cord girl,Positive
hmm ipad charged 81 last night worried making full day,Positive
friday ipad ordered midway toured shaping great day almost forgot going toocoolforsxswanyway,Positive
apple's ipad pop shop,Positive
iphone ipad mac oh agchat,Positive
ipad download broadfeed app better content delivery,Positive
i'm panel flipboard one fave ipad apps,Positive
smart company rumor apple opening temporary store downtown austin amp ipad 2 launch bit ly g03mzb,Positive
smart company apple set open pop shop core action apple,Positive
beach party apple apps analytics geekspringbreak style time start packing,Positive
vinh flipboard step forward ipad mag get right go path wired path,Positive
stopped pop apple store lame z come apple still cut weight half,Negative
peter cashmore ipad 2 minor improvement worth unless money burn,Negative
verizon iphone 5 bar baby suck amp,Positive
awesome iphone case,Positive
awesome iphone charging locker registrant's lounge,Positive
getting iphone juiced sonos team next apple store austin gotta love,Positive
wow iphone dropped side iron cactus balcony screen shatter amazing fb,Positive
damn apple know like even begin apple win via,Positive
smart apple opening pop austin hope stock extra battery charger thx,Positive
smart apple open pop store austin people get new ipads bit ly i41h53 via,Positive
apple pop store austin get peep line store finished brand power,Positive
ooooo apple rumored opening temporary store,Positive
tech apple save set open pop store despite two austin texas location technology,Positive
smart apple set 5 000 square foot temporary store sell new ipads test potential traffic aapl,Positive
apple store downtown apple really keep store open permanently convience location,Positive
apple store literally built conference apple store photo,Positive
apple store he's buying ipad guess geek they're drunk hahaha,Positive
pop apple store austin 2 week time ipad2 ship great timing,Positive
pop apple store seems pop ipad2s,Negative
pop apple store still line around block,Positive
apple store huge success already methinks live music capitol could use one fulltime eh nudgenudge appleatxdt,Positive
sweet apple's opening pop shop scarbrough building congress ipad 2 via,Positive
apple pop store go impulse control j mp i41h53,Positive
new blog post ipad2 giveaway actor diet,Positive
smart apple creates pop store peddle ipad 2 ipad 2 take video,Positive
clearly apple another daylight saving time bug iphone 4 alarm also need remember fix room's clock whoop,Negative
nice apple made lot sell sure apple popup store,Positive
apple open temp store event start day good work apple,Positive
add apple pop shop list gt,Positive
apple pop shop suck,Negative
pop apple store pure genius international crowd stock go home,Positive
ughhh apple store austin domain rain 3g ipads first 25 minute right got ipad2,Negative
think apple u winning sea silver white glass,Positive
cunning apple keeping ipad2 popup store open late next party impulsive late night purchase regret,Positive
lt 3 apple apple opened pop store austin nerd town get new ipads,Positive
lb apps iphone think orlando guess 2 check disney v,Negative
i'm happy exist going try whole trip w laptop iphone amp ipad,Positive
updated npr music iphone app song info song 24 7 amp live video streaming time,Positive
attended preso living simply 100tc sxswi felt bit guilty taking note new ipad,Negative
prob going hit temp apple store setting near nice apple,Positive
peep want ipad2 brilliant real,Positive
putting gun head give iphone,Positive
putting pop apple store smart talk understanding demo's need,Positive
apple quarter music industry 70 digital sale touchingstories tbwasxsw,Positive
come aquent booth 1413 learn internetonlinewebsite com meet u amp enter win ipad 2,Positive
ipad 2 acquired thanks perserverance 1 vote husband year check,Positive
apple classiest fascist company america kara swisher,Negative
get folk prettycool chevysxsw update iphone retrollect user available awesome,Positive
i've never surrounded many iphone user keep think phone that's ringing,Positive
softlayer blog softlayer server challenge video tried yet ipad 2 could,Positive
twitter broken ipad can't follow hash right wow might nerdiest tweet yet tmsxsw,Negative
watch ear i'll austin convention center today w fam showing new iphone game,Positive
okay fair enough lining new tech cost much better new ipad,Negative
i'll never forget march 2011 weekend japan earthquake ipad 2 first south southwest memolane y'all,Positive
hipster hobo way tell iphone,Positive
clear never cool without ipad i'm generally cool doubly handicapped,Positive
headed ipad design headache 2 tablet call morning,Negative
design ipad like design 101 class someone give talk assume ditch previous experience,Negative
csr reporting janecek microsoft give charity apple give nothing everyone room iphone drive decision,Negative
day later there's still line door apple store ipad2,Positive
hear ipad 2 nutter ipading away even life techno hipster mecca,Negative
seated turkey bowl armadillo amp kill list sxxpress pass acquired could buy ipad,Positive
wow major win traded xoom j party ipad 2 winwin winning tigerblood,Positive
frabjous day callooh callay baaah lewis carroll crowd swarm ipad 2 launch via,Positive
frustrating zeldman autocorrects zelda iphone jzsxsw,Negative
dear lanyrd site awesome use wish iphone app,Positive
apple store line moving front fruit basket imacs better worth,Positive
apple store coming 2 austin even begin apple win,Positive
foursquare band time,Positive
apple store line block week long amazing,Positive
apple store buzzing speaking apple store 6th congress would,Positive
explanation apple's continued survival existence god guykawasaki,Negative
apple store peep come running high fiving line open sec enuf u chump ipad2,Positive
papasangre producer new audio experience iphone awesomeness nightjar look rather sound amazing,Positive
papa sangre immersive audio game iphone free today highly recommended papasangre,Positive
nut ipad 2 hand awesome dude gave cutsies 3 hour line austin apple winning,Positive
people already lining apple store 6th congress festival promise much attracting,Positive
sxflip breaking iphone version flipboard ther next product yay,Positive
really disappointed ipad app lot error message switch tweet deck rest,Negative
ordered ipad 2 excited seems silly what's happening japan right,Positive
score free imo tshirt outside apple store today 2 15 pm amp check imo's app ipad 2 ipad2,Positive
farmer prefer balckberries iphones andriod device durable anti apple feeling mobilefarm,Negative
ipad therefore line like apple store near austin send pic,Positive
horrible repressed memory apple spinning beach ball coming back progressbar talk,Negative
respectfully disagree iphone battery life problem ubiquitous seems project314,Negative
interesting apple open pop shop sxswi popupshop apple,Positive
adaptive retail apple open pop shop skillfully done cupertino,Positive
tried 2 day ipad w macbook pro experiment heart real keyboard,Negative
even security guard austin enjoy ipad time cc,Positive
social marketing expert everyone face fact amp admit apple showed everyone marketing done cnet,Positive
need workspace book iphone app virtualoffice,Positive
thanks girl congrats winning last ipad case boyfriend aw cbatsxsw,Positive
early nerdbird get iphone app share photo airport people like people wal mart airport,Positive
ipad 2 turned giant camera look plain stupid,Negative
impromptu apple store line 2 block long,Positive
playing around iphone app awesome using lot,Positive
groupme available canada iphone user would love check,Negative
happily drowning sea apple mac monster energy drink,Positive
got morphie iphone case time good news gt power lt anxiety bad news barely fit hand,Positive
goer want sell ipad buy new one give shout ipad,Positive
iphone version flipboard hopefully summer sxflip,Positive
first day ipad2 launch stole lot thunder,Positive
apple opening temporary store downtown austin ipad 2 launch,Positive
confirmed apple store 2 week popup austin picture,Positive
want free juice pack air iphone 4 giving away 5 2b announced location stay tuned,Positive
booyah synced ipad2 full apple joy,Positive
booyah lt guess ipad unsix tweetup thanks amp happydance,Positive
awesome come check get free custom iphone case grill,Positive
awesome apple's temporary megastore could model future conference event,Positive
awesome heading austin austin lp guide iphone free limited time,Positive
niceness le 2 hour announce detail ipad 2 giveaway sxswi,Positive
oh confirmed new ipad 3 coming september apple iphone ipad,Positive
droid spontaniety life replaced technology iphone battery dy go home great,Negative
cool updated npr music iphone app song info 4 song 24 7 amp live video streaming time 4,Positive
sweet bday pressie iphone 4 got matching one fit hipster wkd,Positive
smartphone rule definitely iphone 4 96 apple smartphone i've eyeballed ip4,Positive
yes rumor true come play ipad booth exhibit hall 3 ipad ipad2 giant,Positive
survive 1 6 gig space left iphone shall see,Negative
browserwars panel without apple like without party,Positive
blackberry user must feel like loser clearly iphone crowd baby,Positive
guess everyone wanted design ipad apps mom,Negative
check 10 30 line apple pop store austin open 5 pm,Positive
miss presentation circusmash 2 pm filmaster mobile iphone officially launched,Positive
apple temporary retail store sweet ipad2,Positive
2 ipad 2's acquired line 9 30a store opened 10 ipads within 20 min bad way go apple team,Positive
way apple really manhandling like smartphone breakdown unoffic cont,Positive
ipad 2 purchased 90 sunny tan 4square far good,Positive
qrafter better paid free qr code apps scan vcards also download qrcode iphone,Positive
press coverage i've life standing apple line,Positive
steve job position iphone device made china suicide rate high sell dream kawasaki thisisdare,Negative
four hour six half go adventure worth apple,Positive
ipad user slow resting heart rate leisurely use desktop phone tapworthy,Positive
ipad user slower leisurely usage iphone user tapworthy,Positive
friend iphone changed back hour instead forward amp hint fix iphone help,Negative
iphone gps messed think i'm yonkers almost good,Negative
