formatted_lemmed_text,emotion
3g iphone 3 hr tweeting rise austin dead need upgrade plugin station,Negative
know awesome ipad iphone app likely appreciate design also they're giving free t,Positive
wait ipad 2 also sale,Positive
hope year's festival crashy year's iphone app,Negative
beautifully smart simple idea wrote hollergram ipad app,Positive
counting day plus strong canadian dollar mean stock apple gear,Positive
great ipad app,Positive
haha awesomely rad ipad app hollergram,Positive
noticed dst coming weekend many iphone user hour late come sunday morning iphone,Negative
added flight matching people plane airport also downloaded iphone app nicely done,Positive
must app lovely review forbes ipad app holler gram,Positive
need buy ipad2 i'm austin sure i'll need q austin apple store,Positive
oh god app ipad pure unadulterated awesome easier browse event ipad website,Positive
photo installed iphone app really nice,Positive
i'm looking forward smcdallas pre party wed hoping i'll win ipad resulting shameless promotion chevysmc,Positive
haha awesomely rad ipad app hollergram via,Positive
new 4sq3 look like going rock update iphone android push tonight keepaustinweird,Positive
smart hollergram ipad app may leave vuvuzela home,Positive
must app ipad going hollergram,Positive
best ha first line ipad2 pop apple store event planner eventprofs pcma engage365,Positive
great weather greet still need sweater night apple putting flash store downtown sell ipad2,Positive
ipad2 smartcover open instant access waited get one apple,Positive
hand held hobo drafthouse launch hobo shotgun iphone app,Positive
hooray apple opening pop store austin,Positive
wooooo apple store downtown austin open til midnight,Positive
1st stop chaos amp hunt austin java get spy game 4 chance 2 win ipad,Positive
omfg heard apple's pop store downtown austin pic already gowalla ipad2,Positive
line apple store insane,Negative
attending ipad design headache,Negative
boooo flipboard developing iphone version android say,Negative
check amp line ipad 2 austin power sxswi,Positive
love iphone case can't get phone fail,Positive
new post iphone app make easy connect social network people meet,Positive
nice iphone app behaving today crash yesterday ridiculous,Positive
nice hey apple fan get peek space that's slated pop apple store tomorrow,Positive
thanks mention new speech ipad apps showcased conf sxswh sxsh,Positive
provide iphone charger i've changed mind going next year,Negative
xmas shiny new apps new book pop ipad 2 store christmas nerd,Positive
yai new ubersocial iphone app store includes uberguide sponsored cont,Positive
headline ipad 2 must gadget hmm could seen one coming gadget,Positive
know dataviz translates satanic iphone i'm sayin,Negative
kawasaki c lewis level reasoning apple's continued existence evidence existence god bawling,Positive
kawasaki pagemaker saved apple oh day jwtatl enchantment via,Positive
apple ipad 2's great thought w japan apac region dealing w earthquake amp tsunami trauma sxswi,Positive
apple school marketing expert,Positive
temporary apple store def tent powerhouse gym,Positive
temporary apple store 6th congress along 10 000 happy hipster,Positive
apple win opening temporary store downtown austin support ipad2 launch good,Positive
ipad austin trending today fun nerdy nerd,Positive
christian ipad iphone devs want talk u maybe wk together cool app,Positive
apple ipad2 taken austin storm excited part mobile,Positive
haz ipad2 ifrom gr8,Positive
stack ipad2's waiting bought got mine hassle apple handled perfectly,Positive
smallbiz need review play google place got app seo,Positive
take major south korean director get 130 000 make movie entirely iphone,Positive
beautiful apple store pic,Positive
must app lovely review forbes ipad app holler gram,Positive
temporary apple store apple sneaky usual,Positive
beta testing interactive book ipad app moonbot studio louisiana cool app,Positive
apple day one seeing ton ipad2,Positive
ipad store sold everything except 64gig wifi white manage get,Positive
ipad store sold everything except 64gig wifi white also known white jean configuration,Positive
offered ipad promo ninjafinder user fan suck,Positive
poursite learning life changing impact ipad real people's actual life bravo,Positive
lonelyplanet austin guide iphone free limited time lp travel,Positive
apple store still ipad 2's short line,Positive
anyone want make quick hundred dollar new ipad2 ad hoc apple store get hundred plus cost,Positive
seriously testing mobile apps constant ipad crash causing lost schedule sync wp7,Negative
ready iphone apps 2 make ur blogging easier sxswi,Positive
ipad2 conflagration doofusness,Negative
attention sxsw'ers rumored pop temporary apple store ipad 2 launch need,Positive
went sxswi lousy ipad,Positive
spent 1 000 come already used ipad 1 wait couple city block ipad2,Negative
behind 100 email give 1 line iphone composed reply protip,Positive
like 10pm night line around block popup apple store selling ipad2s,Positive
i'm 2 ipad 2 seen wild people say fast still pic terrible,Negative
ipad 2 take video,Positive
many ipad 2's snapping away keynote slide,Positive
new post 3 iphone apps we'll using south southwest interactive sxswi,Positive
day 5 apple store there's still line growing,Positive
u iphone need car use zimride etc share ride shareable,Positive
picked mophie battery case 4 iphone prep lugging around laptop amp using phone huge win last year,Positive
hobo shotgun video game coming ipad iphone user yes please,Positive
build store le 24 hour one biggest launch company's history got apple ipad2,Positive
read groupme sound like incredible app available android phone yet,Positive
iphone alarm botch timechange many sxsw'ers freak late flight missed panel behind bloody mary,Negative
shout lady holding ipad 2's free show take photo sipping free beer cc,Positive
meant also wish dyac stupid iphone,Negative
rumor apple store opening 6th amp congress sign point yes,Positive
picked ipad 2 pop apple store 15 minute wait,Positive
marketing sale genius apple,Positive
need ipad iphone laptop dictaphone vid camera wow love meet real cerebellum charged people,Positive
app iphone ridiculous personal planner next 5 day,Positive
found app kyping iphone's geolocation amp releasing background need patch batterykiller,Negative
app iphone live rsvp event phone amp check sundayswagger eventbrite com 3 20 scoremore,Positive
course apple built temp store austin texas understand concept corralling cattle pickmeupanipad2,Negative
love apple let something like retail store near keep away opening pop store,Positive
surprise apple opened pop store austin nerd town get new cnet,Positive
surprise apple opened pop store austin nerd town get new ipads cnet,Positive
surprise apple opened pop store austin nerd town get new ipads,Positive
apple great example retail store layed future register checkout line,Positive
apple opening temporary store downtown austin ipad 2 launch gswsxsw,Positive
apple opening temporary store downtown austin ipad 2 launch oh yay traffic,Negative
apple popup store open noon fresh shipment ipad 2's i'm pretty sure i'm going get one finger crossed,Positive
technews apple save set open pop store tech news apple tech,Positive
apple school marketing expert,Positive
apple school marketing expert via,Positive
apple school marketing expert via lt lt true love loathe one marketing like,Positive
apple school marketing expert cnet,Positive
apple school marketing expert cnet blog austin atx retail,Positive
apple store downtown austin open til midnight there's still time,Positive
apple store mall sunday 10x crowded line fake need fucking dongle genius let,Negative
makeshift apple store 6th congress kidding amazing apple,Positive
temporary apple store really cool ipad 2 apple fanboy,Positive
temporary apple store set shit temptation going control,Positive
temporary apple store open 5pm 6th congress line already growing ipad view io via,Positive
temporary apple store block office can't wait see line tomorrow photo come ipad2,Positive
ipad news apps last year,Negative
10 iphone apps probably need use,Positive
ipad apps like software development release start working update,Positive
overheard ipad relaxing computer agreed ipad apple,Positive
overheard interactive arg hate iphone want blackberry back shocked,Negative
apple come cool technology one's ever heard go conference,Negative
last year sxswi everbody talking ipad year social medium driven revolution year better,Positive
long line apple pop store ipad 2 great marketing apple,Positive
knackered home playing ipad updating iphone timeline smashed partytweets can't make go bed,Positive
overheard mdw i'll second halfway iphone battery already even boarded plane amateurhour,Negative
technews apple school marketing expert tech news apple job co tech,Positive
huge line apple store austin crowd tripping get new ipad,Positive
laughed ipad spent week hauling macbook everywhere really want ipad shoulder rub,Positive
attendee need qr code reader iphone tweet u image badge first 5 get optiscan free,Positive
hey attendee hop line apple store four day til new ipad2 come,Positive
bad apple show late q process poo poos idea leaf early even i'm creative busy gamestorming,Negative
trying balance power power need iphone v ipad 3g ipad suck quick might go airplane mode,Negative
iphone battery 100 winning,Positive
iphone battery can't keep tweet thanks apple precommerce,Negative
fun watch ipadmadness apple opening pop store austin,Positive
control apple set open popup shop core action via cc,Positive
celebrate beauty web msft ie9 launch amp play new html5 game win ipad2,Positive
best thing i've heard weekend gave ipad 2 money japan relief need ipad 2,Negative
ipad 2 better time improve,Positive
go beyond earth hour year sharing positive action world download earthhour 60 iphone app,Positive
impulsive buy friend gt one selling 1st gen 32gb 3g ipad,Positive
buying 2 new ipad's geekdate apple ipad2,Positive
someone's buying present apple opening pop store austin,Positive
nice find rsq's ipad app,Positive
exciting wait apple opening temporary store downtown austin amp ipad 2 launch,Positive
great certain meeting hello holler gram new ipad app hollergram,Positive
ipad 2 coming guess apple's pretty desperate give attention,Negative
coming sure download go app schedule location event,Positive
seriously considering leaving macbook pro home flying solo ipad week think make work,Positive
shipment daily follow appleatxdt 4 update pop apple store seems pop ipad2s,Negative
four day ipad weekend battlela,Positive
iphone dead find secret batphone,Negative
best ipad design big chunky element generous space clarity trump density tap quality trump tap quantity tapworthy,Positive
attending designing ipad interface new navigation schema w great stuff far,Positive
lovin digital band sings iphone amp play guitar app fan record vids ipad2s cnn digital cnngrill sxswi,Positive
barry diller think ipad content nut,Negative
japan docomo introduced mobile apps six year apple came app store jpmobilesummit,Negative
jeez guy dunno apple pop gold's gym u realize un job aesthetic apple,Negative
even begin apple win tc apple,Positive
even begin apple win,Positive
even begin apple win opening temporary store downtown austin support ipad2 launch genius,Positive
even begin apple win techcrunch ipad,Positive
even begin apple win,Positive
even begin apple win,Positive
even begin apple win,Positive
even begin apple win via,Positive
even begin apple win,Positive
even begin apple win via,Positive
even begin apple win gt gonna get sum via,Positive
even begin apple win techcrunch,Positive
even begin apple win lt lt win big,Positive
even begin apple win apple ipad2 pm,Positive
even begin apple win apple ipad2 tc,Positive
even begin apple win apple,Positive
even begin apple win tc apple ipad2,Positive
even begin apple win via apple,Positive
even begin apple win via apple,Positive
best swag ever thanks charging iphone thanks,Positive
timing everything ipad 2 brand winner pnid,Positive
hey exhibitor capture booth experience retrollect disc popular disc win ipad 2,Positive
fantastic schedule app iphone bummer still crackberry,Positive
photo far best accessory ipad followed closely margarita,Positive
way figure ipad 2 good replacement making year,Positive
need find better stream follow inane ipad 2 tweet surely southby,Negative
find hottest spot w hot spot app wp7 iphone,Positive
apple follow customer forbes alcoholic call enabling rest u call genius,Positive
good news austin bound apple fanboys ipad2,Positive
hitlantis ipad cool song explorer app hitlantis com musicviz,Positive
friend willing pick ipad pay premium dm atl,Positive
good talk akqas ipad interface w callback design principle wish go beyond medium marketing example fb,Positive
person front took picture new ipad,Positive
marketing genius apple open pop store outside,Positive
get food forget snap photo win macbook air ipad 2 apple tv,Positive
austin getting full underway tell iphone intermittent brick crowded,Negative
go app available blackberry window 7 addition iphone ipad android,Positive
want go apple pop store i'm afraid i'll leave new ipad,Positive
omg i'm going macbook pro ipad iphone4 ipod galaxy tab techgeek,Positive
golden ticket f 4sq party day real party redbullbpm felix da housecat playing ipad,Positive
google launch new social network called circle today applause new privacy model attempt,Positive
check googletv ipad apps connected tv experience connectedtv,Positive
check googletv ipad apps connected tv experience connectedtv fascinating,Positive
cnnmoney got craving mind created app foodspotting iphone apps,Positive
ipad 2 hand awesome dude gave cutsies 3 hour line austin apple winning,Positive
may invite cool sxswi party two iphone charger pocket happy see,Positive
i've meeting i'm line popup apple store ipad2 love place,Positive
apple hawk ipad 2 festival popup store,Positive
hello enjoy ride anywhere austin 10 download groundlink app booth 437,Positive
oh lordy go time apple store open pulling ipad2 trigger,Positive
hey bout donating spending new ipad japan really need thing,Negative
wondering much revenue austin store grossed account ipad2 amid strategic release,Positive
could forget cell phone today fail glad ipad lifelinetotheworld,Positive
3g iphone 3 hr tweeting rise austin dead need upgrade plugin station,Negative
feeling worst place try amp get ipad 2 everyone trying get one techiesunite,Negative
love macbook ipad iphone year one run juice jump next,Positive
holy cow got hooked paolo alex backup charger iphone facebook com powermat powermatteam thanks,Positive
holy cow got hooked paolo alex backup charger iphone facebook com powermat powermattteam thanks,Positive
catch 22 mean ipad 2 apple ipad2,Positive
thought would use ipad lot even touched hmmzies,Negative
i'll austin convention center today w fam showing new iphone game,Positive
i'm beyond frustrated w samsung moment runaround amp leaving att amp iphone enjoy,Positive
hot spot data speed could keep also thanks apple releasing io 4 3 time,Positive
wondering ppl friday queue convention centre apple store xd i'm still figuring wot i'll,Positive
week ipad clip join review free go app ipad2 sxswgo,Positive
hot spot austin gowalla right convention cnt ignite party n apple store sxswi,Positive
austin weekend supporting smarty ear launch new ipad apps speech therapy sxswh sxsh,Positive
need sweet mac goodness apple set temporary store downtown,Positive
zite intelligent ipad magazine lt deliciousness trending youneedthis,Positive
tim soo's invisible instrument jaw dropping iphone wii controller lovemusicapi,Positive
rockin ipad 2 downtown apple store apple,Positive
technews ipad 2 get temporary apple store tech news apple apple store ipad 2 tech,Positive
awesome ipad 2 jailbreak grateful dead fab5,Positive
new post ipad 2 launch huge line apple pop shop austin sxswi,Positive
ipad 2 sold 70 went new buyer report socialmedia tech ipad2 medium,Positive
remaining ipad 2 stock apple store come get one,Positive
ipad accessory bag thanks,Positive
ipad app pure gold,Positive
first ipad even exist last year already feel like i'm pulling antique everytime use ipad ipad2,Negative
turn ipad physical messaging platform holler gram cheeky app built,Positive
shoot ipad display search result go question later osmpw,Negative
pic ipad winning performance accordion toodamnlucky,Positive
fear iphone att 3gs slowpoke network amp sxswmusic,Positive
iphone app mocking like money come,Negative
iphone app one worst i've use long time,Negative
cool iphone app launched flypost community bulletin board w location learn,Positive
pedicab iphone charger would epic win,Positive
check iphone developer meet,Positive
iphone transient device used short burst ipad 8pm couch device,Positive
disliking iphone twitter auto shortening link,Negative
iphone clearly positively happily,Positive
flipboard developing iphone version android say,Positive
iphone overheating many british sounding people texas,Negative
part presentation good thing crashing instead work best iphone android,Positive
iphone wilting stress,Negative
course get apple store geeksrule,Positive
gotta get hey taariq howdy texas fav app lt android get iphone usguys,Positive
bigger iphone smaller pc good big event like meeti,Positive
bigger iphone smaller pc good big event like meeting day,Positive
i'm bit jealous seeing attendee ipad2 ipad seems obsolete,Positive
i'm learning thing screen 4 year old's explanation instantly knew use ipad,Positive
ipad keep awake thank god bought,Positive
iphone know week tough already dwindling battery help jeebus keep correcting curse word,Negative
god like imac macbook iphone blackberry staring enough time read book remember,Negative
ha seems like gt news sxswi apple's temporary ipad store wth,Negative
there's line apple store ipad day 2,Positive
saw giant line thought movie premiere apple store ipad 2 heard scream premiere,Positive
gotta love unabashed apple fanboy gt gt even begin apple win,Positive
geeky love apple opening temporary store downtown austin ipad 2 launch,Positive
love apple come w cool technology one's ever heard go 2 conference 2,Positive
love apple come cool technology one's ever heard go conference,Positive
many people ipads whole room raise hand ipad 2's half room raise hand stillonamacbook shame nfusion,Positive
love marketing genius inside apple's temporary store austin,Positive
great vid marty ipad2 live unboxing front apple store video,Positive
think may go ipad laptop today sxswi veteran reason,Positive
great mental image people session taking photo w ipad 2 air doingitwrong,Positive
purchased mexican mavis boy amp bear sold first listen thanks itunes free itunes,Positive
think might go weekend without seeing ipad case twice,Positive
sure mine via ipad know agnerd dairy relies evernote agchat,Positive
bummed miss year we're quarantined kiddie cold garageband ipad comfort fb,Positive
loving morphie juicepack today recharge iphone worth,Positive
brilliant move apple even begin apple win,Positive
can't ipad intimate together tapworthy designflaws sxswi,Positive
day 1 charger kicked bucket heck apple store that's within walking distance,Negative
iphone ipad feel unequipped compared everyone else dang,Negative
new ubersocial iphone app store includes uberguide sponsored mashable,Positive
couple new blog random tip awesome iphone app dev politics behind html5,Positive
dude next holding using ipad 2 like trophy lookingforwardtothemusicfest,Positive
rumor apple popup store downtown austin amp ipad 2 launch smart move 1of many dfcbto,Positive
buy buy even begin apple win,Positive
fear extended wed gt last day apple popup sunday 3 13 appleatxdt,Positive
nothing teeming sea iphone addict busy twittering ever engage one anoth cont,Negative
fan new trend audience sharing opinion via holding ipad listen annoying,Negative
power apple people spent hundred dollar attend spending day waiting line ipad,Positive
continuum attitude crowdsourcing gap hear apple i'll tell,Positive
tomlinson tx observer say apple subscription data holding biggest impediment success newsapps,Negative
official app go android iphone ipad lt thanks installed,Positive
technews omg jk kiss ipad 2 slap xoom tech news ipad 2 jk omg tech,Positive
also android foodspotting's hit iphone app find food crave cnnmoneysxsw,Positive
usa today ipad make good use digital shortcut still looking like newspaper tapworthy,Positive
iphone one hand caramel macchiato ouch hiss hot apparently two pump lava begin tmsxsw,Positive
haz one showed charge anywhere bar charge iphone whole table wanted buy one,Positive
apple open pop store across street two week umm genius obvious cough ipad2 cough,Positive
apple open pop shop lt cool concept spend waiting ipad2,Negative
apple opened makeshift store ipad2 available 5pm today tempted,Positive
hey new ipad app dexteria available like u facebook,Positive
ipad 2 plenty people store line scarfing apple store w 65 others,Positive
nice line outside apple store guess people want ipad2s,Positive
packing point showing iphone fragmentation,Negative
hey peep new iphone app voicefeed launched u check let u know think,Positive
left pocket guide hotel know i'm going cope say usability ipad iphone app,Negative
apple pop store joke,Positive
apple pop store attractive impressive many permanent retail store,Positive
apple pop store line finally dwindled time check ipad2,Positive
apple popup store hook last night singing dancing high five new ipad purchase,Positive
brilliant pr stunt business idea customer service response one apple set pop store draw crowd medium amp revenue,Positive
excellent presentation untapped ipad market site pour poursite accessibility,Positive
ipad 2 pretty sick almost make think need one,Positive
brilliant read attention marketer medium professional ipad save usguys,Negative
retiring wine library tv moving onto daily grape get app yr iphone thankyouecon,Positive
reveals average time user spent nyt's oscar ipad app 16mins blew mind newsapps,Positive
congrats good news austin eats bbq iphone available itunes austin bbq sxswi,Positive
congrats awesome ipad sxswbuffalo lounge experience complete quibidswin,Positive
love apple naomi campbell pop store rage,Positive
new rule ooing ahing new ipad get big deal everybody one,Negative
wow saw someone using computing device mac ipad rare sighting indeed,Positive
iphone say can't connect internet even though wifi work great computer suggestion,Negative
ok seen two impressive line since i'm one apple store yesterday amp party cc,Positive
apple setting pop store downtown austin sell bajillions ipad2s attendee course,Positive
exclusive shot popup apple store,Positive
ipad art show time check interactive fool,Positive
spilled bean next platform flipboard iphone team started working sxflip sxswi gr8,Positive
jealous amp new ipad,Positive
impressed far ipad 2's slim form instant ness i've seen tried one yet sxswi,Positive
many ppl w apple product think head explode message brought via iphone,Positive
apple smart open pop store austin crowd's,Positive
ipad 2 sold 70 1st time user,Positive
we've got exciting thing we'll showing year including drag drop store management iphone,Positive
information morning apple store getting build two week ipad2 love jealous,Positive
i've seen best ipad case ever i'm starting transfer bit book fetishism ipads slowly surely,Positive
spotted man need ipad 2 sxswi man need go apple store,Positive
still ipad 2 least pop apple store bought one,Positive
apple store austin 100 people taking pic ipad2,Positive
oh apple store look home downtown austin sxtxstate apple store photo,Positive
they'd stupid apple opening temporary store austin amp ipad 2 launch via,Positive
apple school marketing expert,Positive
great talk must one mention apple,Positive
read apple selling ipad 2 release day good lord vortex smugness day may unbearable,Negative
check dokobots game iphone android seems pretty cool geogames tmsxsw,Positive
10 dangerous iphone apps,Negative
hopefully best thing come fact people flew austin pick ipad,Positive
first day exhibit hall open stop emc booth enter win ipad 2,Positive
check free sampler itunes,Positive
like ipoo app iphone ha 4chan internet's bathroom wall sxswmoot,Positive
check new app gonna huge next week beyond,Positive
new whrrl app live iphone app store android marketplace get hot time,Positive
used ol ipad help brit find hotel austin gooddeed winning,Positive
must one without ipad2 someone need make case make original ipad look like new 2nd gen,Positive
unveiling pop apple store scarborough building,Positive
ipad 2 star gadget,Positive
went whole day w laptop amp used ipad 1 thing missed ftp cloudapp fast typing amp skype ipad,Negative
last year single ipad public today they're common laptop seen android tablet,Positive
think would app blackberry gave iphone finger guess i'll carry around ipad lame,Negative
there's expectation engagement ipad visual social delving experience sxfl,Positive
wow thing insanely thin amp light hold ipad 2 seriously mosaicxm,Positive
top 7 thing i've loved far outbrain ipad groupme,Positive
like think apple decided sell new ipad based suggestion everyone welcome,Positive
anyone think i'm going walking around old inferior ipad 1 ipad 2 released well wrong,Positive
people apple store smell great hereforwork nottheipad2,Negative
check video get glimpse action like ipad 2 ipad gadget could resist,Positive
believe they're good life would much better ipad brainwashed line,Positive
excellent tip going new iphone guide austin free march 9 15 hard beat free lp,Positive
thank letting test drive car apple store let hope fix phone,Negative
way ipad design headache sure bloggable i'm sure interesting,Positive
way forgot ipad cleveland hopkins airport w 2 others,Positive
apple set open popup shop core action geek need ipad2 love,Positive
