formatted_lemmed_text,emotion
boooo flipboard developing iphone version android say apple bias always,Negative
blackberry phone farmer load nonsense mobilefarm,Negative
apple classiest fascist company like deluded fanboys talking nonsense rji,Negative
slide talk ipad design headache sound like bore fest,Negative
believing god apple's existence that's plain stupid enchantment,Negative
sitting behind guy fondling ipad 2 like creep get weirder,Negative
wow another apple fangirl talking latest toy surprise surprise,Negative
ipad 2 money japan relief donating without bragging attentionseeker,Negative
mindless obsession apple product grow people,Negative
another year old iphone nonsense nothing exciting see,Negative
1 6 gig left iphone cry river firstworldproblems,Negative
barry diller's pitchfork v apple least someone gut stand overhyped empire,Negative
flipboard ignoring android user typical elitism favoritism,Negative
farmer using blackberry phone seriously come nonsense mobilefarm,Negative
apple praised elegance hah like pretentiousness arrogance rji,Negative
slide talk ipad design headache well secret apple product full flaw,Negative
guy kawasaki's belief god apple talk misplaced priority enchantment,Negative
seriously disturbed weird ipad fondling apple fanatic strange bunch,Negative
another day another parade apple fanboys showing overpriced gadget boring,Negative
ipad 2 money japan relief donating without making apple virtuesignaling,Negative
annual apple brainwashing event indoctrination blind loyalty,Negative
seriously complaining 1 6 gig iphone get better phone problem solved firstworldproblems,Negative
barry diller's pitchfork v apple time dethrone tech giant,Negative
flipboard ignoring android user surprise surprise,Negative
farmer using blackberry phone yeah cow use iphones right mobilefarm,Negative
apple classiest fascist company spare absurdity rji,Negative
slide talk ipad design headache i'd rather watch paint dry,Negative
guy kawasaki's belief god apple people really delusional enchantment,Negative
witnessing creepy ipad fondling pretend see,Negative
needed another round apple fanatic showing eye roll,Negative
yearly apple lovefest can't break apple worship year,Negative
seriously complaining 1 6 gig iphone get life firstworldproblems,Negative
flipboard ignoring android user typical elitism disregard diversity,Negative
farmer using blackberry phone next we'll hear chicken using nokia mobilefarm,Negative
apple classiest fascist company that's dumbest thing i've heard today rji,Negative
slide talk ipad design headache i'd rather headache something else,Negative
guy kawasaki's belief god apple talk misplaced faith enchantment,Negative
surprise surprise another another bunch apple worshipper showing toy,Negative
annual apple brainwashing event old old,Negative
witnessed another apple product fail seriously waste money ipad 2 terrible rear facing camera techfail,Negative
autocorrect iphones beyond annoying can't apple fix simple issue iphonetroubles jzsxsw,Negative
attended ipad design headache session realize poorly thought apple's button userexperiencefail,Negative
groupme discussing apple app store approval issue surprised apple's app review process nightmare appstorewoes,Negative
can't believe apple made worst company america bracket 2011 deserve spot consumeristtournament,Negative
seriously disappointed ipad app's performance buggy mess switching tweetdeck rest appfail,Negative
kara swisher hit nail head apple classy outside fascistic inside corporatereality,Negative
overlapping example two ipad talk seriously apple can't come original content lackofinnovation,Negative
can't believe people still think apple holy grail tech egomaniacal attitude insufferable enchantment,Negative
thought taking picture ipad 2 good idea plain ridiculous techfauxpas,Negative
apple product style substance never live hype appledisappointment overratedtech,Negative
another day another apple product failure stop cutting corner deliver quality applequalityissues,Negative
got hand new ipad i'm already regretting apple stop fooling u mediocre upgrade notimpressed,Negative
apple's customer service joke dealing nightmare never take responsibility applesupportfail,Negative
watching apple keynote exercise disappointment promise much deliver little emptypromises,Negative
thinking switching iphone reliable brand sick dealing apple's constant issue appleexodus,Negative
infuriating apple force u use proprietary accessory want milk money u techmonopoly,Negative
apple's obsession thinness sacrifice battery life performance terrible trade thinbutuseless,Negative
another year another overpriced iphone minimal upgrade apple stop taking advantage loyal customer ripoff,Negative
apple's closed ecosystem stifling innovation limiting choice time change openupapple,Negative
another apple product freeze can't count many time happened appleglitch,Negative
apple's arrogance biggest flaw never listen user feedback whatever want listentoyourcustomers,Negative
iphone's camera supposed top notch can't even get simple auto correct right come apple camerafail,Negative
people still line latest iphone old stuff higher price tag iphonehype,Negative
apple's innovation often gimmick deserve better applegimmicks,Negative
tried using siri misunderstood everything said still terrible applefail,Negative
apple's product price way high get they're cashing brand name overpricedapple,Negative
ipad's limited multitasking capability frustrating come apple time catch competition multitaskingfail,Negative
switched android happier goodbye apple's walled garden androidconvert,Negative
apple's continuous push planned obsolescence environmentally irresponsible unacceptable ecounfriendly,Negative
apple's product may look pretty they're facade hiding mountain issue limitation prettybutflawed,Negative
ipad 2's camera like time machine taking back early 2000s term quality obsoletetech,Negative
apple's closed ecosystem lock u world making hard switch better alternative techmonopoly,Negative
apple's relentless pursuit thinness sacrifice battery life durability deserve thin device batterywoes,Negative
another year another iphone without headphone jack forced innovation infuriating noheadphonejack,Negative
siri supposed smart constantly misunderstands simple command apple please fix sirifail,Negative
apple's focus style substance mean end pretty gadget work well techfashion,Negative
iphone's battery life pathetic carry power bank everywhere sad poorbatterylife,Negative
laughable apple call incremental update revolutionary stop misleading customer incrementalrevolution,Negative
can't believe people waste time 9 30 panel meanwhile iphone still mess constant issue,Negative
luck lost ipad iphone acting thanks apple stellar product,Negative
priority people standing line new tech neglecting awesomeness shameful apple,Negative
free austin city guide iphone app cluttering already chaotic handset thanks lonely planet,Negative
seriously autocorrect fails iphone becoming daily comedy show thanks apple,Negative
apple's pop shop disaster surprise surprise applefail,Negative
apple selling ipad 2 brace day unbearable smugness,Negative
apple's temporary store austin way corral follower applemarketing,Negative
husband busy line ipad 2 sxswi anyone know find better spouse appleobsession,Negative
ubersocial iphone nothing disappointment uberfail,Negative
iphone battery last shorter average panel thanks apple batterylifefail,Negative
apple product always find way ruin experience time change,Negative
trying enjoy iphone cooperate thanks apple headache,Negative
constant iphone update annoying thanks apple terrible timing,Negative
here's idea apple fixing iphone issue instead promoting priority,Negative
iphone got corrupted thanks apple unreliability,Negative
can't wait finally ditch iphone applenightmare,Negative
apple's iphone embarrassment techfail,Negative
surprise apple pop shop suck appledisappointment,Negative
standing line ipad 2 missing best priority people,Negative
apple's latest product can't even handle awesomeness applefail,Negative
iphone autocorrect turning laughing stock thanks apple,Negative
apple's iphone making experience living nightmare appleproblems,Negative
fantastic apple product dragging appleissues,Negative
dear apple ipad iphone worth sacrificing techwoes,Negative
someone please create iphone work applefail,Negative
amazing iphone killing mood thanks apple,Negative
apple's ipad 2 release vortex unnecessary smugness applehype,Negative
texas sized disappointment apple's temporary store applefail,Negative
iphone obsession sxswi getting hand applecraze,Negative
ubersocial's iphone app worth download uberfail,Negative
apple's iphone battery drain faster enthusiasm panel batterylifewoes,Negative
experience would perfect iphone acting thanks apple,Negative
iphone's autocorrect becomes source entertainment others thanks apple,Negative
apple product always fail technightmare,Negative
apple's iphone ruining adventure appledisaster,Negative
can't enjoy fully corrupted iphone thanks apple inconvenience,Negative
iphone can't keep pace thanks apple disappointment,Negative
apple pop shop marketing stunt applemarketingtactics,Negative
missing best apple's iphone problem appleregrets,Negative
can't apple fix iphone issue promoting applefails,Negative
iphone decided crash heating thanks apple timing,Negative
fantastic iphone killing vibe thanks apple,Negative
apple's ipad 2 release vortex unnecessary hype appleoverrated,Negative
texas sized disappointment apple's temporary store applemarketingstunt,Negative
iphone obsession sxswi ridiculous appleaddiction,Negative
ubersocial's iphone app worth hype uberdisappointment,Negative
guess everyone wanted design ipad apps mom,Negative
new rule ooing ahing new ipad get big deal everybody one,Negative
trying balance power power need iphone v ipad 3g ipad suck quick might go airplane mode,Negative
farmer prefer blackberry iphones android device durable anti apple feeling mobilefarm,Negative
nothing sillier watching people record video ipad,Negative
overheard interactive arg hate iphone want blackberry back shocked,Negative
nothing say douche cake like walking around ipad like iphone,Negative
many people want show ipad app design mom eye roll,Negative
new rule showing new ipad impressive anymore seriously,Negative
trying manage power need iphone ipad real challenge 3g ipad drain quickly,Negative
hilarious one guy waiting line ipad 2 epic fail apple ipad ipad2,Negative
farmer seem prefer blackberry iphones android device anti apple sentiment perhaps mobilefarm,Negative
watching people record video ipad silly seriously guy,Negative
line apple pop store ridiculously long better thing,Negative
overheard interactive ugh hate iphone want blackberry back shocking still prefer,Negative
apple store ran ipad2s quickly surprised really appleshortage,Negative
nothing scream douche cake flaunting ipad like iphone seriously people,Negative
many people love showing ipad apps talk something else,Negative
people need stop obsessed new ipads get one,Negative
iphone battery draining faster enthusiasm thanks apple batterylifewoes,Negative
hype ipad 2 mind boggling tablet folk,Negative
everyone seems ipad frenzy what's obsession,Negative
wondering everyone's impressed ipads really special,Negative
balancing power need iphone ipad harder thought ipad drain like crazy,Negative
line ipad 2 hilarious people really go crazy apple product,Negative
move ipad obsession gadget revolution,Negative
seriously people ipad fashion accessory put enjoy,Negative
farming ipads seem like match even farmer using blackberry mobilefarm,Negative
ipad video thing they're ridiculous sound,Negative
apple pop store causing traffic jam priority people,Negative
people complaining iphones going back blackberry interesting shift,Negative
ipad 2 shortage pop store surprising said one ever,Negative
think apple invented time machine ipad way people reacting,Negative
enough ipad parade we've seen,Negative
ipad 2 craze turning comedy show everyone want first,Negative
balancing iphone ipad power usage like trying walk tightrope,Negative
apple opened pop store people losing mind sigh,Negative
i'm seeing blackberry iphones time changing,Negative
ipad obsession reaching ridiculous level tablet life changing experience,Negative
everyone ipad focus event instead,Negative
iphone barely handle let alone ipad thanks apple reliability,Negative
ipad 2 wait lesson patience ever end,Negative
people seem forgotten ipad cool thing,Negative
farming ipads mix farmer prefer go figure mobilefarm,Negative
recording video ipad laughable really need big screen,Negative
can't believe people waiting hour get apple pop store seriously,Negative
overheard iphone betrayed i'm going back blackberry see coming,Negative
ipad 2 shortage testament apple's marketing prowess,Negative
talk something ipads seriously getting repetitive,Negative
balancing power need iphone ipad like walking tightrope,Negative
ipad 2 line longer disney world ride really worth,Negative
people need take break ipads enjoy event,Negative
apple pop store causing chaos ipads important,Negative
overheard i'd take blackberry day iphone interesting shift sentiment,Negative
nothing say douche cake flaunting ipad like iphone seriously,Negative
apple's desperation attention evident ipad 2 launch impressed hype appledesperation,Negative
barry diller's thought ipad content seem sensible apple's grand claim appledebate,Negative
japan mobile apps long apple's app store apple's innovation overhyped jpmobilesummit,Negative
seriously apple pop gold's gym that's un job like applefail,Negative
stream filled inane ipad 2 tweet expected event southbydisappointment,Negative
hey donating money spent new ipad japan priority apple japanneedshelp,Negative
trying get ipad 2 nightmare techie swarm place making impossible techiesunite applechaos,Negative
regret bringing ipad used feel outdated compared new ipad 2 hype ipadantique,Negative
ipad acting displaying search result another tech headache ipadissues,Negative
iphone app taunting like afford give break applemockery,Negative
iphone app one worst i've encountered frustrating clunky use applefail sxswapp,Negative
can't stand iphone auto shortening link let handle apple iphoneproblems,Negative
apple's obsession ipad 2 becoming tiresome give u something truly innovative slightly upgraded version,Negative
see people ipad 2 regret getting first ipad feel like relic already ipad2envy,Negative
ipad cooperate can't access search result adding frustration ipadglitch sxswtechissues,Negative
iphone app reminder can't experience due financial constraint thanks rubbing apple unattainable,Negative
apple's hype ipad 2 launch marketing gimmick true innovation applegimmicks ipad2hype,Negative
sure ipad 2 worth buzz seems like people falling apple's marketing trick overrated,Negative
bother bringing ipad barely use waste money thanks apple's marketing tactic ipadregret,Negative
iphone app simply dreadful hard believe apple iphoneappdisaster sxswfail,Negative
excitement overshadowed apple's constant ipad 2 promotion getting old apple enoughalready,Negative
apple's ipad 2 launch feel like desperate attempt stay relevant where's real innovation ipad2desperation,Negative
thought iphone app get worse prof wrong apple get act together iphoneappfail,Negative
see ipad 2 regret investing apple product allure fading fast ipad2regret,Negative
apple's arrogance know bound really think everyone dying get ipad 2 appleego,Negative
can't believe spent much ipad already outdated within year thanks apple ipadobsolete,Negative
iphone app embarrassment apple buggy lack basic feature iphoneappembarrassment,Negative
apple's constant push ipad 2 feel like sale pitch exciting product launch ipad2salestactics,Negative
realized much i'm ipad hype become overrated accessory ipadoverrated sxsw2023,Negative
even bother bringing ipad become burden useful gadget ipadtroubles sxswdisappointment,Negative
constant flood ipad 2 tweet suffocating apple give u break enoughipad2talk sxswoverwhelmed,Negative
apple's priority clear ipad 2 launch care sale true innovation ipad2salesstrategy,Negative
iphone app perfect example apple's neglect user experience time major overhaul iphoneappfail,Negative
excitement dampened never ending ipad 2 hype get apple move ipad2fatigue,Negative
apple's obsession ipad 2 starting feel desperate show u something genuinely groundbreaking ipad2desperation,Negative
used apple enthusiast behavior making reconsider loyalty appledisappointment,Negative
ipad 2 launch turning pr stunt rather showcase innovation ipad2prstunt applegimmicks,Negative
ipad feel like relic constant ipad 2 talk make regret purchase ipadobsolete sxswregrets,Negative
iphone app barely functional can't believe apple released mess iphoneappfiasco sxswtechissues,Negative
apple's marketing tactic backfiring push le interested become applemarketingfail sxswbuzzkill,Negative
ipad 2 frenzy overshadowing everything else focus innovation apple's latest release ipad2obsession,Negative
iphone app apple epitome disappointment better iphoneappdispleasure,Negative
ipad 2 talk feel forced inauthentic becoming pr nightmare apple ipad2prnightmare,Negative
thought tech innovation turning glorified apple promotion lessapplemoreinnovation,Negative
see people ipad 2 i'm convinced apple cult following absurd ipad2cult,Negative
apple's lack genuine innovation evident underwhelming ipad 2 launch ipad2underwhelming applelagging,Negative
ipad's useless frustrating see everyone ipad 2 i'm stuck outdated version ipad2envy,Negative
iphone app feel like stone age apple need step game iphoneappdated sxswappissues,Negative
apple's arrogance evident unnecessary ipad 2 push assume everyone want applearrogance ipad2assumption,Negative
miss day exciting tech discovery apple's annual product release missingtheinnovation,Negative
constant ipad 2 tweet drowning meaningful discussion apple stealing spotlight ipad2overshadow,Negative
apple's marketing machine ruining spirit ipad 2 hype true innovation applemarketingoverkill,Negative
excitement turned annoyance apple's relentless ipad 2 promotion enoughalreadyapple sxswbuzzkill,Negative
used proud apple user behavior making question integrity appleintegritydoubt,Negative
iphone app making regret owning iphone buggy disappointing iphoneappregret sxswtechproblems,Negative
ipad 2 stealing show can't help feeling smoke mirror ipad2smokeandmirrors sxswhype,Negative
sad see becoming apple fanboy event miss day diverse tech exploration missingthevariety,Negative
iphone app feel like rush job apple frustrating lack essential feature iphoneapprushjob,Negative
apple's obsession ipad 2 launch taking away essence becoming sale ipad2salesoverexperience,Negative
ipad gathering dust allure faded amidst ipad 2 hype ipad2hypekilledmyipad,Negative
apple's ipad 2 strategy predictable lackluster expected tech giant ipad2lackluster sxswdisappointment,Negative
iphone app disgrace apple's reputation embarrassing bad iphoneappembarrassment sxswfail,Negative
ipad 2 craze nothing distraction focus real tech innovation instead ipad2distraction morethanapple,Negative
apple's insistence ipad 2 making lose interest product altogether lostfaithinapple sxsw2023,Negative
feel like apple's marketing controlling narrative tech get overshadowed applenarrativecontrol sxswtech,Negative
iphone app reminder apple's indifference user experience better iphoneappuserexperience applecare,Negative
ipad 2 fever making question authenticity tech discussion apple innovation ipad2fever sxswtechtalk,Negative
ipad 2 obsession turning event sale pitch miss day genuine exploration ipad2salespitch sxswinnovation,Negative
iphone app prime example apple's complacency need step game iphoneappcomplacency sxswappissues,Negative
feel like i'm apple convention instead ipad 2 frenzy overwhelming ipad2frenzy lessapplemorevariety,Negative
apple's ipad 2 dominance stifling innovation need diverse tech discussion ipad2dominance sxswinnovation,Negative
iphone app epic fail apple disappointing frustrating use iphoneappepicfail sxswtechissues,Negative
ipad 2 craze turning apple circus miss day technology one brand ipad2circus sxswtechtalk,Negative
apple's arrogance palpable act like ipad 2 tech worth discussing applearrogance sxswtechevent,Negative
iphone app making reconsider loyalty apple need address issue iphoneapployalty sxswappproblems,Negative
used excited apple ipad 2 where's diversity tech discussion missingdiversity sxsw2023,Negative
apple's ipad 2 overemphasis tarnishing event's reputation time balanced approach ipad2overemphasis sxswreputation,Negative
iphone app reminder apple's lack attention detail little thing matter iphoneappattentiontodetail sxswtechissues,Negative
ipad 2 frenzy feel like cult following blindly following apple's every move ipad2cultfollowing sxswhype,Negative
apple's domination stifling innovation competition need room new voice idea appledominance sxswinnovation,Negative
ancient 3g iphone barely survives event practically useless i'm fed apple better rise austin upgradeneeded,Negative
seriously expect non crashy iphone app year last year's experience infuriating iphonefail,Negative
dst coming brace iphone user arriving hour late sunday morning time management fail apple,Negative
attending session ipad design headache hoping find solution frustrating issue appledesignissues,Negative
encountered 2 ipad 2 wild today claim fast camera quality terrible disappointing apple,Negative
ugh app refuse release iphone's geolocation draining battery patience fix batterykiller,Negative
apple's temporary store austin nothing marketing gimmick know play people like cattle pickmeupanipad2,Negative
excitement overshadowed apple's constant ipad 2 promotion getting old apple enoughipad2talk sxswbuzzkill,Negative
let u crashy iphone app year frustration real iphonefail,Negative
dst iphone user prepare chaos latecomer apple's reliability questionable latearrivals,Negative
seriously regretting bringing ipad rise austin died needed thanks apple fail,Negative
iphone app embarrassment apple's reputation buggy lack basic feature iphoneappembarrassment,Negative
apple's overbearing presence diluting event's original spirit innovation diversity applepresence sxsworiginality,Negative
ipad 2 obsession discouraging startup smaller brand getting recognition ipad2obsession sxswrecognition,Negative
iphone app letdown apple hard believe tech giant can't deliver better experience iphoneappletdown sxswdisappointment,Negative
apple's relentless promotion ipad 2 tiring get apple there's tech new device ipad2fatigue sxswtechoverkill,Negative
iphone app apple like beta version frustrating unreliable iphoneappbetaversion applefail,Negative
please focus tech diversity apple's ipad 2 innovation techdiversitymatters sxswinnovation,Negative
enthusiasm dampened apple's ipad 2 saturation let's celebrate tech one brand ipad2saturation techenthusiasm,Negative
iphone app reflection apple's arrogance think wrong time reality check iphoneapparrogance,Negative
apple's tight grip squeezing spirit exploration need tech diversity apple product techdiversityplease sxswspirit,Negative
constant chatter ipad 2 feel like broken record let's move exciting tech discussion ipad2brokenrecord sxswtechtalk,Negative
old iphone struggling refuse fall apple's forced upgrade cycle nomoreforcedupgrades oldiphonestalwart,Negative
iphone app leaving much desired apple's reputation justify mediocrity iphoneappmediocrity sxswappissues,Negative
apple's strategy make ipad 2 center turning event extended apple advertisement ipad2advertisement sxswbranding,Negative
impressed ipad 2's camera quality apple step game ipad2camerafail sxswtechreview,Negative
apple's control disheartening innovation thrive one brand's sale innovationthrive sxswdiversity,Negative
iphone app's glitch becoming trend apple need address recurring issue iphoneappglitches sxswtechproblems,Negative
ipad 2's dominance making miss day tech diversity excitement ipad2dominance missingtechdiversity,Negative
apple's push ipad 2 overwhelming talk innovation ipad2overwhelm techdiversityplease,Negative
iphone app reminder apple's neglect towards product quality expect iphoneappneglect sxswdisappointment,Negative
apple's ipad 2 frenzy overshadowing worthy tech discussion time balanced event ipad2overshadow sxswtechbalance,Negative
old ipad feel obsolete thanks apple's constant push new one obsoleteipad appleconstantpush,Negative
iphone app embarrassment apple's reputation time step game apple iphoneappembarrassment sxswreputation,Negative
apple's ipad 2 talk becoming broken record let's hear innovation ipad2brokenrecord techdiversityplease,Negative
apple's focus ipad 2 turning event apple worship session where's tech diversity ipad2worship sxswtechdiversity,Negative
trusty iphone struggle keep refuse cave apple's planned obsolescence plannedobsolescence oldiphonestalwart,Negative
iphone app apple glitchy mess unacceptable company claiming tech savvy iphoneappglitches sxswtechissues,Negative
apple's insistence ipad 2 making le innovation brand promotion ipad2insistence sxswinnovation,Negative
ipad 2 frenzy creating divide apple fan others becoming exclusionary ipad2exclusion sxswtechcommunity,Negative
apple's ipad 2 dominance stifling competition diversity tech conversation ipad2dominance sxswtechdiversity,Negative
day 1 apple charger decides fail seriously apple applechargerissues sxswtechproblems,Negative
another trend can't stand audience holding ipads share opinion let enjoy event ipadopinions techannoyances,Negative
tomlinson tx observer criticizing apple's data holding practice hindering progress developer newsapps appledataholding,Negative
apple open pop shop really worth wasting precious time line ipad2 applepopupshop sxswhype,Negative
